sno,question,a,b,c,d,correct
1,What does communication refer to?,The process of traveling,The activity of expressing ideas and feelings,The art of drawing pictures,The action of reading and writing,b
2,What involves the act of sharing and exchanging information with people?,Travel,Education,Communication,Entertainment,c
3,How might prehistoric humans have communicated?,Through written language,Using mobile phones,By drawing pictures,Through the internet,c
4,What did prehistoric humans use to communicate with each other?,Letters,Drum beats and smoke signals,Emails,Text messages,b
5,What did people learn much later in history?,To draw pictures,To use drums and smoke signals,To read and write,To communicate with actions,c
